id,type,title,country,year,rating,genre
s4746,Movie,Da Kath & Kim Code,Australia,2005,TV-PG,Movies
s4747,Movie,Kath & Kimderella,Australia,2012,TV-14,Comedies
s4749,Movie,The Mansion,"France, Belgium",2017,TV-MA,"Comedies, Horror Movies, International Movies"
s4750,Movie,Coco y Raulito: Carrusel de ternura,Mexico,2018,TV-MA,Stand-Up Comedy
s4752,Movie,Extinction,United States,2018,TV-MA,"Action & Adventure, Dramas, Sci-Fi & Fantasy"
s4756,Movie,Parmanu: The Story of Pokhran,India,2018,TV-PG,"Dramas, International Movies"
s4757,Movie,Iliza Shlesinger: Elder Millennial,United States,2018,TV-MA,Stand-Up Comedy
s4758,Movie,The Warning,Spain,2018,TV-MA,"International Movies, Thrillers"
s4761,Movie,Duck Duck Goose,"China, United States, United Kingdom",2018,PG,"Children & Family Movies, Comedies"
s4766,Movie,Nothing to Lose,Brazil,2018,PG,"Dramas, Faith & Spirituality, International Movies"
s4769,Movie,Camarón: The Film,Spain,2018,TV-14,"Documentaries, International Movies, Music & Musicals"
s4770,Movie,GODZILLA City on the Edge of Battle,Japan,2018,TV-14,"Action & Adventure, Anime Features, International Movies"
s4771,Movie,Going for Gold,Australia,2018,TV-G,"Children & Family Movies, Dramas, International Movies"
s4774,Movie,How It Ends,United States,2018,TV-MA,"Action & Adventure, Sci-Fi & Fantasy"
s4775,Movie,Jim Jefferies: This Is Me Now,United States,2018,TV-MA,Stand-Up Comedy
s4776,Movie,Romina,Mexico,2018,TV-MA,"Horror Movies, Independent Movies, International Movies"
s4780,TV Show,Mr. Sunshine,South Korea,2018,TV-MA,"International TV Shows, Korean TV Shows, Romantic TV Shows"
s4782,Movie,Luciano Mellera: Infantiloide,Argentina,2018,TV-14,Stand-Up Comedy
s4783,Movie,The Legacy of a Whitetail Deer Hunter,United States,2018,TV-14,"Action & Adventure, Comedies, Dramas"
s4784,Movie,The Skin of the Wolf,Spain,2018,TV-MA,"Dramas, Independent Movies, International Movies"
s4785,Movie,White Fang,"France, Luxembourg, United States",2018,TV-PG,"Children & Family Movies, Dramas"
s4786,Movie,Sommore: Chandelier Status,United States,2013,TV-MA,Stand-Up Comedy
s4787,Movie,Felipe Esparza: They're Not Going to Laugh at You,United States,2012,TV-MA,Stand-Up Comedy
s4788,Movie,Joan Rivers: Don't Start with Me,United States,2012,TV-MA,Stand-Up Comedy
s4789,Movie,Katt Williams: Kattpacalypse,United States,2012,TV-MA,Stand-Up Comedy
s4790,Movie,King of Peking,"China, United States, Australia",2018,TV-14,"Comedies, Dramas, International Movies"
s4791,Movie,Anthony Kaun Hai?,India,2006,TV-14,"Comedies, Dramas, International Movies"
s4792,Movie,Bo Burnham: what.,United States,2013,TV-MA,Stand-Up Comedy
s4793,Movie,Chalte Chalte,India,2003,TV-14,"Dramas, International Movies, Romantic Movies"
s4794,Movie,Deewana Main Deewana,India,2013,TV-14,"Comedies, Dramas, International Movies"
s4795,Movie,Duck Butter,United States,2018,TV-MA,"Dramas, Independent Movies, LGBTQ Movies"
s4796,Movie,I Am Kalam,India,2010,TV-PG,"Children & Family Movies, Comedies, Dramas"
s4797,Movie,My Birthday Song,India,2018,TV-14,"Dramas, International Movies, Thrillers"
s4798,Movie,Namastey London,India,2007,TV-14,"Comedies, Dramas, International Movies"
s4800,Movie,Soul Robbers,Mexico,2015,TV-14,"Horror Movies, International Movies"
s4801,Movie,Tum Milo Toh Sahi,India,2010,TV-14,"Comedies, Dramas, International Movies"
s4803,Movie,Zoo,India,2018,TV-MA,"Dramas, Independent Movies, International Movies"
s4804,Movie,Bill Burr: You People Are All the Same,United States,2012,TV-MA,Stand-Up Comedy
s4806,Movie,The Maus,Spain,2017,TV-MA,"Horror Movies, Independent Movies, International Movies"
s4807,Movie,Calibre,United Kingdom,2018,TV-MA,"Dramas, International Movies, Thrillers"
s4809,Movie,Jani Dueñas: Grandes fracasos de ayer y hoy,Chile,2018,TV-MA,Stand-Up Comedy
s4811,Movie,Penalty Kick,"Colombia, Mexico",2018,TV-14,"Comedies, Dramas, International Movies"
s4813,Movie,TAU,United States,2018,R,"Sci-Fi & Fantasy, Thrillers"
s4815,Movie,W. Kamau Bell: Private School Negro,United States,2018,TV-MA,Stand-Up Comedy
s4817,Movie,Expelled from Paradise,Japan,2014,TV-MA,"Action & Adventure, Anime Features, Sci-Fi & Fantasy"
s4818,Movie,"To Each, Her Own",France,2018,TV-MA,"Comedies, International Movies, LGBTQ Movies"
s4820,Movie,Brain on Fire,"United States, Canada, Ireland",2016,PG-13,"Dramas, Independent Movies, International Movies"
s4823,Movie,Us and Them,China,2018,TV-MA,"Dramas, International Movies, Romantic Movies"
s4824,Movie,Hannah Gadsby: Nanette,Australia,2018,TV-MA,Stand-Up Comedy
s4826,Movie,Lust Stories,India,2018,TV-MA,"Comedies, Dramas, International Movies"
s4827,Movie,Maktub,Israel,2018,TV-MA,"Comedies, International Movies"
s4829,Movie,Set It Up,United States,2018,TV-MA,"Comedies, Romantic Movies"
s4830,Movie,Sunday's Illness,Spain,2017,PG-13,"Dramas, Independent Movies, International Movies"
s4831,Movie,The last hour,"Chile, Peru",2017,TV-MA,"Dramas, International Movies"
s4834,Movie,Alex Strangelove,United States,2018,TV-MA,"Comedies, Dramas, Independent Movies"
s4835,Movie,Ali's Wedding,Australia,2018,TV-MA,"Comedies, Independent Movies, International Movies"
s4836,Movie,Franco Escamilla: Por la anécdota,Mexico,2018,TV-MA,Stand-Up Comedy
s4840,Movie,B.A. Pass 2,India,2017,TV-14,"Dramas, International Movies"
s4841,Movie,Bad Genius,Thailand,2017,TV-MA,"Dramas, International Movies, Thrillers"
s4843,Movie,Outside In,United States,2018,TV-MA,"Dramas, Independent Movies"
s4844,Movie,Pedal the World,Germany,2015,TV-MA,"Documentaries, International Movies, Sports Movies"
s4848,Movie,Sara's Notebook,Spain,2018,TV-MA,"Dramas, International Movies, Thrillers"
s4850,Movie,Fernando Sanjiao: Hombre,Argentina,2018,TV-MA,Stand-Up Comedy
s4851,Movie,Ibiza,United States,2018,TV-MA,"Comedies, Romantic Movies"
s4852,Movie,Steve Martin and Martin Short: An Evening You Will Forget for the Rest of Your Life,United States,2018,TV-14,Stand-Up Comedy
s4855,Movie,Tig Notaro Happy To Be Here,United States,2018,TV-14,Stand-Up Comedy
s4856,Movie,Catching Feelings,South Africa,2018,TV-MA,"Comedies, International Movies, Romantic Movies"
s4859,Movie,Katt Williams: American Hustle (The Movie),United States,2007,TV-MA,Stand-Up Comedy
s4861,Movie,Aiyaary,India,2018,TV-MA,"Action & Adventure, Dramas, International Movies"
s4862,Movie,Lupin the 3rd: The Castle of Cagliostro: Special Edition,Japan,1979,PG-13,"Action & Adventure, Anime Features, Classic Movies"
s4864,Movie,Ali Wong: Hard Knock Wife,United States,2018,TV-MA,Stand-Up Comedy
s4865,Movie,Spivak,United States,2017,TV-MA,"Comedies, Independent Movies"
s4867,Movie,Carlos Ballarta: Furia Ñera,Mexico,2018,TV-MA,Stand-Up Comedy
s4869,Movie,The Kissing Booth,"United Kingdom, United States",2018,TV-14,"Comedies, Romantic Movies"
s4871,Movie,Hari Kondabolu: Warn Your Relatives,United States,2018,TV-MA,Stand-Up Comedy
s4872,Movie,My Fuhrer,Germany,2007,TV-14,"Comedies, International Movies"
s4873,Movie,Family Blood,United States,2018,TV-MA,Horror Movies
s4874,Movie,Pup Star: World Tour,"Canada, Japan, United States",2018,G,"Children & Family Movies, Comedies, Music & Musicals"
s4876,Movie,Anon,"United Kingdom, Canada, United States, Germany",2018,TV-MA,"Dramas, Sci-Fi & Fantasy, Thrillers"
s4877,Movie,Dany Boon: Des Hauts De France,France,2018,TV-MA,Stand-Up Comedy
s4879,Movie,Forgive Us Our Debts,"Italy, Switzerland, Albania, Poland",2018,TV-MA,"Dramas, International Movies"
s4881,Movie,Lo más sencillo es complicarlo todo,Mexico,2018,TV-14,"Comedies, International Movies, Romantic Movies"
s4882,Movie,Manhunt,"China, Hong Kong",2017,TV-MA,"Action & Adventure, International Movies"
s4883,Movie,Thi Mai,Spain,2017,TV-MA,"Comedies, Dramas, International Movies"
s4884,Movie,Si saben cómo me pongo ¿pá qué me invitan?,Colombia,2018,TV-MA,"Comedies, International Movies"
s4885,Movie,Jailbreak,Cambodia,2017,TV-MA,"Action & Adventure, International Movies"
s4886,Movie,Ajji,India,2017,TV-MA,"Dramas, International Movies"
s4887,Movie,CIA: Comrade in America,India,2017,TV-14,"Action & Adventure, Dramas, Independent Movies"
s4889,Movie,Darc,United States,2018,TV-MA,"Action & Adventure, Independent Movies"
s4890,Movie,Despido Procedente,"Argentina, Spain",2017,TV-MA,"Comedies, International Movies"
s4891,Movie,John Mulaney: Kid Gorgeous at Radio City,United States,2018,TV-MA,Stand-Up Comedy
s4892,Movie,My Perfect Romance,Canada,2018,PG,"Comedies, International Movies, Romantic Movies"
s4894,Movie,Pocoyo & The Space Circus,Spain,2008,TV-Y,Movies
s4900,Movie,Sometimes,India,2016,TV-14,"Dramas, International Movies"
s4902,Movie,The Clapper,United States,2017,R,"Comedies, Dramas, Independent Movies"
s4903,Movie,Toc Toc,Spain,2017,TV-MA,"Comedies, International Movies"
s4905,Movie,Running Shaadi,India,2017,TV-14,"Comedies, International Movies, Romantic Movies"
s4906,Movie,The Price of Success,France,2017,TV-MA,"Dramas, International Movies"
s4908,Movie,Candy Jar,United States,2018,TV-14,"Children & Family Movies, Dramas, Romantic Movies"
s4910,Movie,Holy Goalie,Spain,2017,TV-MA,"Comedies, International Movies, Sports Movies"
s4913,Movie,The Week Of,United States,2018,TV-14,Comedies
s4916,Movie,Enissa Amani: Ehrenwort,Germany,2018,TV-MA,Stand-Up Comedy
s4917,Movie,Bill Nye: Science Guy,United States,2017,TV-PG,Documentaries
s4918,Movie,Fishtronaut: The Movie,Brazil,2018,TV-Y,Children & Family Movies
s4919,Movie,Psychokinesis,South Korea,2018,TV-MA,"Action & Adventure, Comedies, International Movies"
s4920,Movie,Kevin James: Never Don't Give Up,United States,2018,TV-PG,Stand-Up Comedy
s4921,Movie,Dude,United States,2018,TV-MA,"Comedies, Dramas, Independent Movies"
s4922,Movie,Kodachrome,"Canada, United States",2018,TV-MA,"Comedies, Dramas"
s4924,Movie,All The Reasons To Forget,Brazil,2017,TV-MA,"Comedies, Dramas, International Movies"
s4928,Movie,Beyond Skyline,"United States, Canada, Indonesia, United Kingdom, China, Singapore",2017,R,"Action & Adventure, Sci-Fi & Fantasy"
s4929,Movie,Come Sunday,United States,2018,TV-14,"Dramas, Faith & Spirituality, Independent Movies"
s4930,Movie,I Am not an Easy Man,France,2018,TV-MA,"Comedies, International Movies, Romantic Movies"
s4932,Movie,Pickpockets,Colombia,2017,TV-MA,"Dramas, Independent Movies, International Movies"
s4933,Movie,Greg Davies: You Magnificent Beast,United Kingdom,2018,TV-MA,Stand-Up Comedy
s4935,Movie,6 Balloons,United States,2018,TV-MA,"Dramas, Independent Movies"
s4936,Movie,Amateur,United States,2018,TV-MA,"Dramas, Independent Movies, Sports Movies"
s4937,Movie,Orbiter 9,"Spain, Colombia",2017,TV-14,"Dramas, International Movies, Sci-Fi & Fantasy"
s4938,Movie,"Ram Dass, Going Home",United States,2018,TV-14,"Documentaries, Faith & Spirituality"
s4939,Movie,Seth Rogen's Hilarity for Charity,United States,2018,TV-MA,Stand-Up Comedy
s4940,Movie,Sun Dogs,"Mexico, United States",2017,TV-MA,"Comedies, Dramas, Independent Movies"
s4941,Movie,Todo lo que sería Lucas Lauriente,Argentina,2018,TV-MA,Stand-Up Comedy
s4944,Movie,Day of the Dead: Bloodline,Bulgaria,2018,R,"Horror Movies, Independent Movies"
s4945,Movie,Fary Is the New Black,France,2018,TV-MA,Stand-Up Comedy
s4946,Movie,Ittefaq,India,2017,TV-MA,"Dramas, International Movies, Thrillers"
s4948,Movie,A Sort of Family,"Argentina, Brazil, France, Poland, Germany, Denmark",2017,TV-14,"Dramas, International Movies, Thrillers"
s4949,Movie,Billu,India,2009,TV-PG,"Dramas, International Movies"
s4951,Movie,John Mulaney: New in Town,United States,2012,TV-MA,Stand-Up Comedy
s4953,Movie,Main Hoon Na,India,2004,TV-14,"Action & Adventure, Comedies, Dramas"
s4954,Movie,Metro,India,2016,TV-14,"Dramas, International Movies, Thrillers"
s4955,Movie,Om Shanti Om,India,2007,TV-14,"Comedies, Dramas, International Movies"
s4956,Movie,Paheli,India,2005,TV-PG,"Dramas, International Movies, Romantic Movies"
s4957,Movie,Phir Bhi Dil Hai Hindustani,India,2000,TV-14,"Comedies, Dramas, International Movies"
s4959,Movie,Revolt,United Kingdom,2017,R,"Action & Adventure, Sci-Fi & Fantasy"
s4960,Movie,First Match,United States,2018,TV-MA,"Dramas, Independent Movies, Sports Movies"
s4961,Movie,Happy Anniversary,United States,2018,TV-MA,"Comedies, Romantic Movies"
s4963,Movie,Sofía Niño de Rivera: Selección Natural,Mexico,2018,TV-MA,Stand-Up Comedy
s4964,Movie,The Titan,"United Kingdom, Spain, United States, Germany",2018,TV-MA,"Dramas, Sci-Fi & Fantasy, Thrillers"
s4966,Movie,Trailer Park Boys: Countdown to Liquor Day,Canada,2009,R,"Comedies, Cult Movies"
s4967,Movie,Trailer Park Boys: The Movie,Canada,2006,R,"Comedies, Cult Movies"
s4969,TV Show,James Acaster: Repertoire,United Kingdom,2018,TV-14,"British TV Shows, International TV Shows, Stand-Up Comedy & Talk Shows"
s4970,Movie,Birdshot,"Philippines, Qatar",2016,TV-MA,"Dramas, International Movies, Thrillers"
s4971,Movie,"Game Over, Man!",United States,2018,TV-MA,"Action & Adventure, Comedies"
s4972,Movie,Layla M.,"Netherlands, Belgium, Germany, Jordan",2016,TV-MA,"Dramas, International Movies"
s4973,Movie,Paradox,United States,2018,TV-MA,"Dramas, Independent Movies, Music & Musicals"
s4975,Movie,Roxanne Roxanne,United States,2018,TV-MA,"Dramas, Music & Musicals"
s4976,Movie,Secret Superstar,India,2017,TV-14,"Dramas, International Movies, Music & Musicals"
s4978,Movie,Benji,"United Arab Emirates, United States",2018,TV-PG,"Children & Family Movies, Dramas"
s4983,Movie,In This Corner of the World,Japan,2016,PG-13,"Anime Features, Children & Family Movies, International Movies"
s4984,Movie,Jag älskar dig: En skilsmässokomedi,Sweden,2016,TV-MA,"Comedies, Dramas, International Movies"
s4987,Movie,The Art of Loving,Poland,2017,TV-MA,"Dramas, International Movies"
s4988,Movie,Steel Rain,South Korea,2018,TV-MA,"Action & Adventure, Dramas, International Movies"
s4990,Movie,Ricky Gervais: Humanity,United Kingdom,2018,TV-MA,Stand-Up Comedy
s4991,Movie,Stretch Armstrong: The Breakout,United States,2018,TV-Y7,Children & Family Movies
s4992,TV Show,A.I.C.O.,Japan,2018,TV-14,"Anime Series, International TV Shows"
s4994,Movie,The Outsider,United States,2018,TV-MA,"Dramas, Thrillers"
s4997,Movie,Bullet Head,"Bulgaria, United States",2017,R,"International Movies, Thrillers"
s4999,Movie,Gad Elmaleh: American Dream,United States,2018,TV-14,Stand-Up Comedy
s5002,Movie,Malena Pichot: Estupidez compleja,Argentina,2018,TV-MA,Stand-Up Comedy
s5003,Movie,Natalia Valdebenito: El especial,Chile,2018,TV-MA,Stand-Up Comedy
s5004,Movie,Ravenous,Canada,2017,TV-MA,"Horror Movies, International Movies"
s5007,Movie,Battle Drone,United States,2018,TV-MA,"Action & Adventure, Independent Movies, Sci-Fi & Fantasy"
s5008,Movie,Dil Se,India,1998,TV-14,"Dramas, International Movies, Romantic Movies"
s5009,Movie,Guru,India,2007,TV-PG,"Dramas, International Movies"
s5010,Movie,Judwaa 2,India,2017,TV-14,"Action & Adventure, Comedies, International Movies"
s5011,Movie,Love Beats Rhymes,United States,2016,R,"Dramas, Music & Musicals, Romantic Movies"
s5012,Movie,Schubert In Love,Germany,2016,TV-14,"Comedies, International Movies"
s5013,Movie,Shubh Aarambh,India,2017,TV-PG,"Dramas, International Movies, Romantic Movies"
s5014,Movie,Something Huge,Spain,2017,TV-MA,"Comedies, Independent Movies, International Movies"
s5015,Movie,Swades,India,2004,TV-PG,"Dramas, International Movies"
s5016,Movie,Swearnet Live,Canada,2014,TV-MA,"Comedies, International Movies"
s5017,Movie,Trailer Park Boys Live at the North Pole,Canada,2014,TV-MA,Movies
s5018,Movie,Trailer Park Boys Live In F**kin' Dublin,Canada,2014,TV-MA,Movies
s5019,Movie,Trailer Park Boys: Say Goodnight to the Bad Guys,Canada,2008,TV-MA,"Comedies, Cult Movies"
s5020,Movie,Trailer Park Boys: Xmas Special,Canada,2004,TV-MA,Movies
s5021,Movie,Tu Hai Mera Sunday,India,2016,TV-14,"Comedies, Independent Movies, International Movies"
s5022,Movie,Yuva,India,2004,TV-14,"Dramas, International Movies"
s5023,Movie,반드시 잡는다,South Korea,2017,TV-MA,"Dramas, International Movies, Thrillers"
s5025,Movie,Marlon Wayans: Woke-ish,United States,2018,TV-MA,Stand-Up Comedy
s5026,Movie,Veronica,Spain,2017,TV-MA,"Horror Movies, International Movies, Thrillers"
s5029,Movie,Mute,"United Kingdom, Germany",2018,TV-MA,"Sci-Fi & Fantasy, Thrillers"
s5032,Movie,Forgotten,South Korea,2017,TV-MA,"Dramas, International Movies, Thrillers"
s5034,Movie,FullMetal Alchemist,Japan,2017,TV-PG,"Action & Adventure, Dramas, International Movies"
s5035,Movie,Agustín Aristarán: Soy Rada,Argentina,2018,TV-MA,Stand-Up Comedy
s5038,Movie,Irreplaceable You,United States,2018,TV-MA,"Dramas, Romantic Movies"
s5040,Movie,Chris Rock: Tamborine,United States,2018,TV-MA,Stand-Up Comedy
s5041,Movie,Love Per Square Foot,India,2018,TV-14,"Comedies, International Movies, Romantic Movies"
s5042,Movie,Seeing Allred,United States,2018,TV-14,Documentaries
s5043,Movie,The Ritual,"United Kingdom, Canada",2018,TV-MA,"Horror Movies, International Movies, Thrillers"
s5045,Movie,When We First Met,United States,2018,TV-14,"Comedies, Romantic Movies"
s5048,Movie,The Cloverfield Paradox,United States,2018,PG-13,"Action & Adventure, Sci-Fi & Fantasy"
s5051,Movie,On Body and Soul,Hungary,2017,TV-MA,"Dramas, International Movies, Romantic Movies"
s5052,Movie,The Bros,South Korea,2017,TV-14,"Comedies, Dramas, International Movies"
s5054,Movie,Newness,United States,2017,TV-MA,"Dramas, Independent Movies, Romantic Movies"
s5056,Movie,Expedition Happiness,Germany,2017,TV-PG,"Documentaries, International Movies"
s5057,Movie,Jerry Seinfeld: I'm Telling You for the Last Time,United States,1998,TV-14,Stand-Up Comedy
s5059,Movie,Holy Camp!,Spain,2017,TV-MA,"Comedies, Dramas, Faith & Spirituality"
s5060,Movie,A Futile and Stupid Gesture,United States,2018,TV-MA,Comedies
s5061,Movie,Fakkah Fuzz: Almost Banned,Singapore,2018,TV-MA,Stand-Up Comedy
s5063,Movie,Sebastián Marcelo Wainraich,Argentina,2018,TV-MA,Stand-Up Comedy
s5065,Movie,Acts of Vengeance,"Bulgaria, United States",2017,R,"Action & Adventure, International Movies"
s5067,Movie,Ricardo Quevedo: Hay gente así,Colombia,2018,TV-MA,Stand-Up Comedy
s5068,Movie,Todd Glass: Act Happy,United States,2018,TV-MA,Stand-Up Comedy
s5072,Movie,Harith Iskander: I Told You So,United States,2018,TV-14,Stand-Up Comedy
s5073,Movie,Step Sisters,United States,2018,PG-13,Comedies
s5074,Movie,The Open House,"Canada, United States",2018,TV-MA,"Horror Movies, Thrillers"
s5075,Movie,Bad Day for the Cut,United Kingdom,2017,TV-MA,"Independent Movies, International Movies, Thrillers"
s5077,Movie,Arango y Sanint: Ríase el show,Colombia,2018,TV-MA,Stand-Up Comedy
s5078,TV Show,Godzilla,Japan,2017,TV-14,TV Shows
s5080,Movie,Alibaba Aur 40 Chor,"Soviet Union, India",1980,TV-14,"Action & Adventure, International Movies, Sci-Fi & Fantasy"
s5081,Movie,Pyar Ke Do Pal,India,1986,TV-14,"Dramas, International Movies, Music & Musicals"
s5082,Movie,Rip Tide,"Australia, United Arab Emirates",2017,TV-PG,"Children & Family Movies, Dramas, Sports Movies"
s5084,Movie,Milada,"Czech Republic, United States",2017,TV-14,"Dramas, International Movies"
s5085,Movie,The Polka King,United States,2018,TV-14,"Comedies, Independent Movies"
s5087,Movie,Tom Segura: Disgraceful,United States,2018,TV-MA,Stand-Up Comedy
s5089,Movie,The House Next Door,India,2017,TV-MA,"Horror Movies, International Movies, Thrillers"
s5092,Movie,Before I Wake,United States,2016,PG-13,"Horror Movies, Thrillers"
s5093,TV Show,Devilman Crybaby,Japan,2018,TV-MA,"Anime Series, International TV Shows, TV Horror"
s5094,Movie,Mustang Island,United States,2017,TV-14,"Comedies, Dramas, Independent Movies"
s5097,TV Show,Fullmetal Alchemist: Brotherhood,Japan,2010,TV-14,"Anime Series, International TV Shows"
s5101,TV Show,Dave Chappelle: Equanimity & The Bird Revelation,United States,2017,TV-MA,"Stand-Up Comedy & Talk Shows, TV Comedies"
s5102,Movie,Fun Mom Dinner,United States,2017,R,"Comedies, International Movies"
s5103,Movie,Goon: Last of the Enforcers,Canada,2016,R,"Comedies, International Movies, Sports Movies"
s5105,Movie,The Climb,France,2017,TV-14,"Action & Adventure, Comedies, Dramas"
s5107,Movie,Bibi & Tina: Tohuwabohu Total,Germany,2017,TV-14,"Children & Family Movies, Music & Musicals"
s5108,Movie,Mr. Roosevelt,United States,2017,TV-MA,"Comedies, Independent Movies"
s5109,Movie,Todd Barry: Spicy Honey,United States,2017,TV-MA,Stand-Up Comedy
s5111,Movie,Creep 2,United States,2017,TV-MA,"Horror Movies, Independent Movies, Thrillers"
s5112,TV Show,Myths & Monsters,United Kingdom,2017,TV-PG,"British TV Shows, Docuseries"
s5114,Movie,Bright,United States,2017,TV-MA,"Action & Adventure, Sci-Fi & Fantasy"
s5115,Movie,Desire,Argentina,2017,TV-MA,"Dramas, International Movies, Romantic Movies"
s5116,Movie,48 Christmas Wishes,Canada,2017,TV-G,"Children & Family Movies, Comedies"
s5117,Movie,Jeremiah Tower: The Last Magnificent,"Mexico, United States",2016,R,Documentaries
s5118,Movie,Russell Howard: Recalibrate,United Kingdom,2017,TV-MA,Stand-Up Comedy
s5122,Movie,Christmas Inheritance,United States,2017,TV-G,"Dramas, International Movies, Romantic Movies"
s5123,Movie,Muramba,India,2017,TV-MA,"Comedies, Dramas, International Movies"
s5124,Movie,Pottersville,United States,2017,PG-13,"Comedies, Independent Movies"
s5125,Movie,Seoul Searching,"South Korea, China, United States",2015,TV-MA,"Comedies, Dramas, International Movies"
s5128,Movie,Judd Apatow: The Return,United States,2017,TV-MA,Stand-Up Comedy
s5130,Movie,El Camino Christmas,United States,2017,TV-MA,"Comedies, Dramas"
s5131,Movie,Jaal,India,1986,TV-14,"Action & Adventure, International Movies"
s5132,Movie,Shikari,"India, Soviet Union",1991,TV-14,"Dramas, International Movies, Music & Musicals"
s5134,Movie,Trolls Holiday Special,United States,2017,TV-Y7,"Children & Family Movies, Comedies, Music & Musicals"
s5135,Movie,Craig Ferguson: Tickle Fight,United States,2017,TV-MA,Stand-Up Comedy
s5136,Movie,Jab Harry Met Sejal,India,2017,TV-MA,"Comedies, International Movies, Romantic Movies"
s5137,Movie,Temple,"Japan, United States",2017,TV-MA,"Horror Movies, Independent Movies"
s5138,Movie,A StoryBots Christmas,United States,2017,TV-Y,"Children & Family Movies, Comedies"
s5143,Movie,Monster Island,"India, Mexico",2017,TV-Y7,Children & Family Movies
s5144,Movie,My Happy Family,"Georgia, Germany, France",2017,TV-14,"Dramas, Independent Movies, International Movies"
s5145,TV Show,Oggy and the Cockroaches,France,2017,TV-Y7,"Kids' TV, TV Comedies"
s5147,Movie,The Worthy,"United Arab Emirates, Romania",2016,TV-MA,"International Movies, Sci-Fi & Fantasy, Thrillers"
s5149,Movie,Voyeur,United States,2017,TV-MA,Documentaries
s5152,Movie,Poster Boys,India,2017,PG-13,"Comedies, International Movies"
s5154,Movie,The Girl from the Song,Spain,2016,TV-MA,"Dramas, Independent Movies, International Movies"
s5159,Movie,Barbra: The Music ... The Mem'ries ... The Magic!,United States,2017,TV-14,Music & Musicals
s5161,Movie,Beat Bugs: All Together Now,"Australia, Canada",2017,TV-Y,"Children & Family Movies, Music & Musicals"
s5162,Movie,Brian Regan: Nunchucks and Flamethrowers,United States,2017,TV-PG,Stand-Up Comedy
s5163,Movie,Saving Capitalism,United States,2017,TV-PG,Documentaries
s5164,Movie,A Christmas Prince,United States,2017,TV-PG,"Children & Family Movies, Dramas, Romantic Movies"
s5165,Movie,"Jim & Andy: The Great Beyond - Featuring a Very Special, Contractually Obligated Mention of Tony Clifton","Canada, United States",2017,TV-MA,Documentaries
s5168,Movie,Mudbound,United States,2017,R,"Dramas, Independent Movies"
s5172,Movie,DeRay Davis: How to Act Black,United States,2017,TV-MA,Stand-Up Comedy
s5173,Movie,Bon Cop Bad Cop 2,Canada,2017,TV-MA,"Action & Adventure, Comedies, International Movies"
s5175,TV Show,Glitter Force Doki Doki,Japan,2017,TV-Y7,"Anime Series, Kids' TV"
s5177,Movie,Mea Culpa,Mexico,2017,TV-MA,Stand-Up Comedy
s5178,Movie,The Killer,Brazil,2017,TV-MA,"Action & Adventure, International Movies"
s5180,Movie,Jerry Seinfeld: Comedian,United States,2002,R,Documentaries
s5182,Movie,The Journey Is the Destination,United States,2016,R,Dramas
s5184,Movie,Mubarakan,India,2017,PG-13,"Comedies, Dramas, International Movies"
s5187,Movie,Bandie,India,1978,TV-PG,"Action & Adventure, Dramas, International Movies"
s5188,Movie,Getaway Plan,Spain,2016,TV-MA,"International Movies, Thrillers"
s5189,Movie,Hajwala: The Missing Engine,United Arab Emirates,2016,TV-PG,"Action & Adventure, Dramas, International Movies"
s5190,Movie,Pettersson and Findus 2,Germany,2016,TV-G,"Children & Family Movies, Comedies"
s5191,Movie,The Bittersweet,China,2017,TV-MA,"Action & Adventure, Dramas, International Movies"
s5197,Movie,Judah Friedlander: America Is the Greatest Country in the United States,United States,2017,TV-MA,Stand-Up Comedy
s5198,Movie,The B-Side: Elsa Dorfman's Portrait Photography,United States,2016,R,Documentaries
s5199,Movie,SPF-18,United States,2017,PG-13,"Dramas, Romantic Movies, Sports Movies"
s5200,Movie,Pup Star: Better 2Gether,Canada,2017,PG,"Children & Family Movies, Comedies"
s5202,Movie,Joan Didion: The Center Will Not Hold,United States,2017,TV-14,Documentaries
s5203,Movie,Strange Weather,United States,2016,R,"Dramas, Independent Movies"
s5204,Movie,The Hateful Eight,United States,2015,R,"Action & Adventure, Thrillers"
s5205,Movie,Jack Whitehall: At Large,United Kingdom,2017,TV-MA,Stand-Up Comedy
s5208,Movie,1922,United States,2017,TV-MA,"Dramas, Thrillers"
s5212,Movie,Wheelman,United States,2017,TV-MA,Action & Adventure
s5213,Movie,Wedding Unplanned,France,2017,TV-MA,"Comedies, International Movies, Romantic Movies"
s5214,Movie,Patton Oswalt: Annihilation,United States,2017,TV-MA,Stand-Up Comedy
s5215,Movie,Baadshaho,India,2017,TV-14,"Action & Adventure, International Movies"
s5218,Movie,Lucknow Central,India,2017,TV-14,"Dramas, International Movies, Music & Musicals"
s5219,Movie,Belief: The Possession of Janet Moses,New Zealand,2015,TV-MA,"Documentaries, International Movies"
s5221,Movie,Singapore,"India, Malaysia",1960,TV-PG,"Comedies, Dramas, International Movies"
