id,type,title,country,year,rating,genre
s6973,Movie,Hiroshima: The Real History,United Kingdom,2015,TV-PG,Documentaries
s6974,Movie,Hisss,"India, United States",2010,TV-MA,"Horror Movies, International Movies, Thrillers"
s6976,Movie,History of Joy,India,2017,TV-14,"Dramas, International Movies"
s6978,Movie,Hitch,United States,2005,PG-13,"Comedies, Romantic Movies"
s6981,Movie,Ho Mann Jahaan,Pakistan,2015,TV-PG,"Dramas, International Movies, Romantic Movies"
s6983,Movie,Hokkabaz,Turkey,2006,TV-MA,"Comedies, Dramas, International Movies"
s6984,Movie,Holding the Man,Australia,2015,TV-MA,"Dramas, International Movies, LGBTQ Movies"
s6985,Movie,Holidays,"United States, Ireland",2016,TV-MA,"Comedies, Horror Movies"
s6987,Movie,Holy Man 2,Thailand,2008,TV-14,"Comedies, Faith & Spirituality, International Movies"
s6988,Movie,Holy Man 3,Thailand,2010,TV-MA,"Comedies, Faith & Spirituality, International Movies"
s6989,Movie,Hombanna,India,2017,TV-14,"Dramas, International Movies"
s6991,Movie,Honey 2,United States,2011,PG-13,"Dramas, Romantic Movies"
s6992,Movie,Honey: Rise Up and Dance,United States,2018,PG-13,Dramas
s6993,Movie,Hoodwinked Too! Hood vs. Evil,United States,2011,PG,"Children & Family Movies, Comedies"
s6994,Movie,Hope Aur Hum,India,2018,TV-14,"Children & Family Movies, Comedies, Dramas"
s6995,Movie,Hope Springs Eternal,United States,2018,PG,Dramas
s6996,Movie,Hope: One in a Billion,"United States, South Africa",2017,TV-14,"Documentaries, International Movies, Sports Movies"
s6998,Movie,Horns,"United States, Canada",2013,R,"Dramas, Horror Movies, Sci-Fi & Fantasy"
s7000,Movie,Horror Story,India,2013,TV-14,"Horror Movies, International Movies"
s7003,Movie,Hostiles,United States,2017,R,Dramas
s7004,Movie,Hot Bot,United States,2016,NR,Comedies
s7005,Movie,Hot Property,United Kingdom,2016,TV-MA,"Comedies, Independent Movies"
s7006,Movie,Hot Rod,United States,2007,PG-13,"Comedies, Sports Movies"
s7008,Movie,Hotel Pacific,"Poland,",1975,TV-MA,"Classic Movies, Dramas, International Movies"
s7009,Movie,Hotel Transylvania 3: Summer Vacation,United States,2018,PG,"Children & Family Movies, Comedies"
s7010,Movie,House at the End of the Street,"United States, Canada",2012,PG-13,"Horror Movies, Thrillers"
s7011,Movie,House of Z,"United States, Canada",2016,TV-14,Documentaries
s7012,Movie,"Houston, We Have a Problem!","Slovenia, Croatia, Germany, Czech Republic, Qatar",2016,TV-14,"Comedies, Independent Movies, International Movies"
s7013,Movie,How the Beatles Changed the World,"United States, United Kingdom",2017,TV-PG,"Documentaries, Music & Musicals"
s7014,Movie,How the Grinch Stole Christmas,United States,2000,PG,"Children & Family Movies, Comedies"
s7015,Movie,How to Be a Latin Lover,"Mexico, United States",2017,PG-13,Comedies
s7016,Movie,How to Be a Player,United States,1997,R,Comedies
s7019,Movie,How to Make an American Quilt,United States,1995,PG-13,"Dramas, Romantic Movies"
s7021,Movie,Hridaynath,India,2012,TV-14,"Dramas, International Movies"
s7022,Movie,Hulk Vs.,United States,2009,PG-13,"Action & Adventure, Sci-Fi & Fantasy"
s7023,Movie,Hum Saath-Saath Hain,India,1999,TV-G,"Dramas, International Movies, Music & Musicals"
s7024,Movie,Humko Deewana Kar Gaye,India,2006,TV-PG,"International Movies, Music & Musicals, Romantic Movies"
s7026,Movie,Hungerford,United Kingdom,2014,TV-MA,"Horror Movies, Independent Movies, International Movies"
s7027,Movie,Hunt to Kill,Canada,2010,R,Action & Adventure
s7028,Movie,Hunter's Prayer,"United States, Spain, Germany",2015,R,"Action & Adventure, Independent Movies"
s7031,Movie,Hurricane Bianca,United States,2016,TV-MA,"Comedies, Independent Movies, LGBTQ Movies"
s7032,Movie,Hurricane Bianca: From Russia With Hate,United States,2018,TV-MA,"Comedies, Independent Movies, LGBTQ Movies"
s7033,Movie,Hustle & Flow,United States,2005,R,"Dramas, Independent Movies, Music & Musicals"
s7035,Movie,Hypersomnia,Argentina,2016,TV-MA,"Horror Movies, International Movies, Thrillers"
s7036,Movie,I Am,"India, Japan",2010,TV-MA,"Dramas, Independent Movies, International Movies"
s7037,Movie,I Am Bolt,United Kingdom,2016,PG,"Documentaries, Sports Movies"
s7038,Movie,I Am Jane Doe,United States,2017,TV-14,Documentaries
s7039,Movie,I Am Maris,United States,2018,TV-14,Documentaries
s7041,Movie,I Am Not Madame Bovary,China,2016,TV-14,"Comedies, Dramas, International Movies"
s7043,Movie,I Am Vengeance,United Kingdom,2018,R,Action & Adventure
s7044,Movie,I Am Wrath,United States,2016,R,"Action & Adventure, Dramas"
s7045,Movie,I Don't Know How She Does It,United States,2011,PG-13,Comedies
s7047,Movie,I Fine... Thank You... Love You,Thailand,2014,TV-14,"Comedies, International Movies, Romantic Movies"
s7048,Movie,"I, Daniel Blake","United Kingdom, France, Belgium",2016,R,"Dramas, Independent Movies"
s7049,Movie,I'll See You in My Dreams,United States,2015,PG-13,"Comedies, Dramas, Independent Movies"
s7050,Movie,I'm in Love with a Church Girl,United States,2013,PG,"Dramas, Faith & Spirituality, Romantic Movies"
s7052,Movie,Ice Guardians,"Canada, Ireland, United States",2016,TV-MA,"Documentaries, International Movies, Sports Movies"
s7053,Movie,Iceman,"China, Hong Kong",2014,R,"Action & Adventure, International Movies, Sci-Fi & Fantasy"
s7054,Movie,Ideachi Kalpana,India,2010,TV-14,"Comedies, International Movies, Romantic Movies"
s7056,Movie,Igor,"United States, France",2008,PG,Children & Family Movies
s7057,Movie,Iliza Shlesinger: War Paint,United States,2013,NR,Stand-Up Comedy
s7058,Movie,Imagine That,"United States, Germany",2009,PG,"Children & Family Movies, Comedies, Sci-Fi & Fantasy"
s7059,Movie,Immoral Tales,France,1974,UR,"Dramas, International Movies, Romantic Movies"
s7061,Movie,In Search of Fellini,United States,2017,R,"Action & Adventure, Dramas"
s7062,Movie,In The Deep,"United Kingdom, United States, Dominican Republic",2017,PG-13,"Horror Movies, International Movies, Thrillers"
s7063,Movie,Incir Receli 2,Turkey,2014,TV-14,"Dramas, International Movies, Romantic Movies"
s7064,Movie,Incoming,"Serbia, United States",2019,TV-MA,"Action & Adventure, Sci-Fi & Fantasy"
s7065,Movie,Incomplete,India,2017,TV-MA,"Dramas, International Movies, Romantic Movies"
s7066,Movie,Inconceivable,"United Kingdom, United States",2017,R,Thrillers
s7068,Movie,Incredibles 2 (Spanish Version),United States,2018,PG,"Children & Family Movies, Comedies"
s7069,Movie,INDIA,India,2014,NR,"Dramas, Independent Movies, International Movies"
s7071,Movie,Indiana Jones and the Kingdom of the Crystal Skull,United States,2008,PG-13,"Action & Adventure, Children & Family Movies, Sci-Fi & Fantasy"
s7072,Movie,Indiana Jones and the Last Crusade,United States,1989,PG-13,"Action & Adventure, Children & Family Movies, Classic Movies"
s7073,Movie,Indiana Jones and the Raiders of the Lost Ark,United States,1981,PG,"Action & Adventure, Children & Family Movies, Classic Movies"
s7074,Movie,Indiana Jones and the Temple of Doom,United States,1984,PG,"Action & Adventure, Children & Family Movies, Classic Movies"
s7075,Movie,Indiscretion,United States,2016,TV-MA,"Dramas, Thrillers"
s7076,Movie,Inequality for All,United States,2013,PG,Documentaries
s7078,Movie,Inglourious Basterds,"Germany, United States",2009,R,Action & Adventure
s7079,Movie,Inkheart,"Germany, United Kingdom, United States",2008,PG,"Action & Adventure, Children & Family Movies, Sci-Fi & Fantasy"
s7080,Movie,Insan,India,2005,TV-14,"Action & Adventure, Dramas, International Movies"
s7085,Movie,Instructions Not Included,Mexico,2013,PG-13,"Comedies, Dramas, International Movies"
s7087,Movie,Internet Famous,United States,2016,TV-14,Comedies
s7088,Movie,Into the Forest,Canada,2015,R,"Dramas, International Movies, Sci-Fi & Fantasy"
s7089,Movie,Inuyasha the Movie - L'isola del fuoco scarlatto,Japan,2004,TV-PG,"Action & Adventure, Anime Features, International Movies"
s7090,Movie,Inuyasha the Movie - La spada del dominatore del mondo,Japan,2003,TV-14,"Action & Adventure, Anime Features, International Movies"
s7091,Movie,InuYasha: The Movie 2: The Castle Beyond the Looking Glass,Japan,2002,TV-14,"Action & Adventure, Anime Features, International Movies"
s7092,Movie,Invictus,United States,2009,PG-13,"Dramas, Sports Movies"
s7094,Movie,Inxeba,"South Africa, Germany, Netherlands, France",2017,TV-MA,"Dramas, Independent Movies, International Movies"
s7095,Movie,Iqbal,India,2006,TV-Y7,"Dramas, Independent Movies, International Movies"
s7096,Movie,Irada Pakka,India,2010,TV-14,"Comedies, Dramas, International Movies"
s7097,Movie,Iron Cowboy: The Story of the 50.50.50,United States,2018,TV-14,"Documentaries, Sports Movies"
s7098,Movie,Iron Man & Captain America: Heroes United,United States,2014,PG,"Children & Family Movies, Sci-Fi & Fantasy"
s7100,Movie,Ishqedarriyaan,India,2015,TV-14,"Dramas, International Movies, Romantic Movies"
s7103,Movie,Issaq,India,2013,TV-MA,"Dramas, International Movies, Music & Musicals"
s7104,Movie,It Takes Two,United States,1995,PG,"Children & Family Movies, Comedies"
s7106,Movie,It's Now or Never,Spain,2015,TV-MA,"Comedies, International Movies, Romantic Movies"
s7107,Movie,"It's Okay, Buddy",Egypt,2017,TV-14,"Comedies, International Movies, Music & Musicals"
s7108,Movie,Iverson,United States,2014,NR,"Documentaries, Sports Movies"
s7110,Movie,Jaan-E-Mann: Let's Fall in Love... Again,India,2006,TV-14,"Dramas, International Movies, Romantic Movies"
s7111,Movie,Jack and the Cuckoo-Clock Heart,"France, Belgium",2013,PG,"Children & Family Movies, Music & Musicals"
s7113,TV Show,Jack Taylor,"United States, Ireland",2016,TV-MA,"Crime TV Shows, International TV Shows, TV Dramas"
s7114,Movie,Jackie Brown,United States,1997,R,"Dramas, Thrillers"
s7115,Movie,Jackpot,Vietnam,2015,TV-14,"Comedies, Dramas, International Movies"
s7116,Movie,Jail,India,2009,TV-14,"Dramas, International Movies"
s7118,Movie,Jal,India,2013,TV-14,"Dramas, Independent Movies, International Movies"
s7119,Movie,Jalpari: The Desert Mermaid,India,2012,TV-14,"Dramas, Independent Movies, International Movies"
s7120,Movie,Janaan,Pakistan,2016,TV-14,"Comedies, Dramas, International Movies"
s7122,Movie,Jay and Silent Bob Strike Back,United States,2001,R,"Comedies, Cult Movies"
s7123,Movie,Jealousy and medicine,Poland,1973,TV-MA,"Dramas, International Movies, Romantic Movies"
s7125,Movie,Jeremy Scott: The People's Designer,United States,2015,PG-13,Documentaries
s7127,Movie,Jersey Boys,United States,2014,R,"Dramas, Music & Musicals"
s7128,Movie,Jesus: Countdown to Calvary,"Ireland, United States, France",2018,TV-14,"Documentaries, Faith & Spirituality"
s7129,Movie,Jewel's Catch One,United States,2016,TV-MA,"Documentaries, LGBTQ Movies"
s7131,Movie,Jimi Hendrix,United States,1973,R,"Documentaries, Music & Musicals"
s7133,Movie,Jiro Dreams of Sushi,United States,2011,PG,Documentaries
s7137,Movie,John Carter,United States,2012,PG-13,"Action & Adventure, Sci-Fi & Fantasy"
s7138,Movie,John Day,India,2013,TV-MA,"International Movies, Thrillers"
s7140,Movie,Jonathan,United States,2018,TV-MA,"Dramas, Independent Movies, Sci-Fi & Fantasy"
s7141,TV Show,Jonathan Strange & Mr Norrell,United Kingdom,2015,TV-14,"British TV Shows, TV Dramas, TV Sci-Fi & Fantasy"
s7142,Movie,Jora 10 Numbaria,India,2017,TV-MA,"Action & Adventure, International Movies"
s7145,Movie,Judwaa,India,1997,TV-14,"Comedies, International Movies, Romantic Movies"
s7146,Movie,Judy Moody and the Not Bummer Summer,United States,2011,PG,"Children & Family Movies, Comedies"
s7148,Movie,Julie & Julia,United States,2009,PG-13,"Comedies, Dramas"
s7150,Movie,Jumping the Broom,United States,2011,PG-13,"Comedies, Romantic Movies"
s7151,Movie,Junebug,United States,2005,R,"Comedies, Dramas, Independent Movies"
s7152,Movie,Jupiter Ascending,"United States, Australia",2015,PG-13,"Action & Adventure, Sci-Fi & Fantasy"
s7153,Movie,Just Friends,"Germany, United States, Canada",2005,PG-13,"Comedies, Romantic Movies"
s7154,Movie,"Justice, My Foot!",Hong Kong,1992,TV-14,"Action & Adventure, Comedies, International Movies"
s7155,Movie,Justin Bieber: Never Say Never,United States,2011,G,"Documentaries, Music & Musicals"
s7157,Movie,K-19: The Widowmaker,"United Kingdom, Germany, Canada, United States",2002,PG-13,"Action & Adventure, Dramas"
s7159,Movie,Kaabil,India,2017,TV-14,"Dramas, International Movies"
s7160,Movie,Kaakan,India,2015,TV-PG,"Dramas, International Movies, Romantic Movies"
s7161,Movie,Kaalia,India,1981,TV-14,"Action & Adventure, Dramas, International Movies"
s7162,Movie,Kaaliyan,India,2017,TV-PG,"Dramas, International Movies"
s7163,Movie,Kabali (Hindi Version),India,2016,TV-MA,"Action & Adventure, Dramas, International Movies"
s7164,Movie,Kacche Dhaagey,India,2016,TV-14,"Dramas, International Movies, Romantic Movies"
s7165,Movie,Kahlil Gibran's The Prophet,"United States, France, Canada, Lebanon, Qatar",2014,PG,"Children & Family Movies, Dramas"
s7166,Movie,Kajraare,India,2010,TV-14,"Dramas, International Movies, Music & Musicals"
s7167,Movie,Kaleidoscope,United Kingdom,2016,TV-MA,Thrillers
s7168,Movie,Kalki,India,2017,TV-14,"Dramas, Independent Movies, International Movies"
s7170,Movie,Karzzzz,India,2008,TV-14,"International Movies, Music & Musicals, Romantic Movies"
s7171,Movie,Kate & Leopold,United States,2001,PG-13,"Comedies, Romantic Movies"
s7172,Movie,Katha,India,1982,TV-PG,"Comedies, Dramas, Independent Movies"
s7173,Movie,Katt Williams: Live,United States,2006,NR,Stand-Up Comedy
s7174,Movie,Kaviyude Osyath,India,2017,TV-14,"Dramas, International Movies"
s7175,Movie,Kay Dyache Bola,India,2005,TV-14,"Comedies, Dramas, International Movies"
s7176,TV Show,Ken Burns: The Civil War,United States,1990,TV-14,Docuseries
s7179,Movie,Kevin Hart: Laugh at My Pain,United States,2011,R,Stand-Up Comedy
s7180,Movie,Kevin Hart: Let Me Explain,United States,2013,R,Stand-Up Comedy
s7181,Movie,Kevin Hart: Seriously Funny,United States,2010,TV-MA,Stand-Up Comedy
s7182,Movie,Kevyn Aucoin: Beauty & the Beast in Me,United States,2017,TV-MA,"Documentaries, LGBTQ Movies"
s7184,Movie,Khalnayak,India,1993,TV-14,"Action & Adventure, Dramas, International Movies"
s7187,Movie,Khosla Ka Ghosla,India,2006,TV-14,"Comedies, Dramas, International Movies"
s7189,Movie,Khubsoorat,India,1980,TV-PG,"Classic Movies, Comedies, Dramas"
s7190,Movie,Khushi,India,2003,TV-14,"Comedies, International Movies, Music & Musicals"
s7191,Movie,Kia and Cosmos,India,2018,TV-14,"Dramas, Independent Movies, International Movies"
s7192,Movie,Kickboxer: Retaliation,United States,2017,R,Action & Adventure
s7193,Movie,Kickboxer: Vengeance,United States,2016,TV-MA,Action & Adventure
s7194,Movie,Kicking and Screaming,United States,1995,R,"Comedies, Independent Movies, Romantic Movies"
s7195,Movie,Kid Kulafu,Philippines,2015,TV-14,"Dramas, International Movies, Sports Movies"
s7196,Movie,Kidnapping Mr. Heineken,"Netherlands, Belgium, United Kingdom, United States",2015,R,"Action & Adventure, Dramas, International Movies"
s7198,Movie,Kill Bill: Vol. 1,"United States, Japan",2003,R,Action & Adventure
s7199,Movie,Kill Bill: Vol. 2,United States,2004,R,Action & Adventure
s7200,Movie,Kill Command,United Kingdom,2016,TV-MA,"Action & Adventure, Independent Movies, Sci-Fi & Fantasy"
s7201,Movie,Kill Hitler! The Luck of the Devil,France,2015,TV-14,"Documentaries, International Movies"
s7202,Movie,Kill Ratio,United States,2016,TV-MA,Action & Adventure
s7203,Movie,Kill the Irishman,United States,2011,R,"Action & Adventure, Dramas, Independent Movies"
s7204,Movie,Killer Klowns from Outer Space,United States,1988,PG-13,"Comedies, Cult Movies, Horror Movies"
s7205,Movie,Killers,United States,2010,PG-13,"Action & Adventure, Comedies, Romantic Movies"
s7206,Movie,Kills on Wheels,Hungary,2016,TV-MA,"Action & Adventure, Dramas, International Movies"
s7207,Movie,Kilo Two Bravo,United Kingdom,2014,R,"Dramas, Independent Movies, Thrillers"
s7208,Movie,King Jack,United States,2015,NR,"Dramas, Independent Movies"
s7209,Movie,King's Ransom,"United States, Canada",2005,PG-13,"Action & Adventure, Comedies"
s7211,Movie,Kingpin,United States,1996,PG-13,"Comedies, Cult Movies, Sports Movies"
s7212,Movie,Kings,"France, Belgium, China, United States",2017,R,Dramas
s7213,Movie,Kis Kisko Pyaar Karoon,India,2015,TV-PG,"Comedies, International Movies"
s7214,Movie,Kiss the Girls,United States,1997,R,Thrillers
s7217,Movie,KL Zombi,Malaysia,2013,TV-14,"Comedies, Horror Movies, International Movies"
s7219,Movie,Knock Knock,"United States, Chile, Israel",2015,R,"Horror Movies, Thrillers"
s7220,Movie,Know Your Enemy - Japan,United States,1945,TV-14,"Classic Movies, Documentaries"
s7221,Movie,Knowing,"United States, United Kingdom, Australia",2009,PG-13,"Sci-Fi & Fantasy, Thrillers"
s7222,Movie,Koko: The Gorilla Who Talks,United Kingdom,2016,TV-G,Documentaries
s7224,Movie,Kon-Tiki,"United Kingdom, Norway, Denmark, Germany, Sweden",2012,PG-13,"Action & Adventure, Dramas, International Movies"
s7225,Movie,Koshish,India,1972,TV-14,"International Movies, Romantic Movies"
s7226,Movie,Kraftidioten,"Norway, Denmark, Sweden",2014,TV-MA,"Comedies, International Movies, Thrillers"
s7231,Movie,Krish Trish and Baltiboy: Face Your Fears,India,2017,TV-Y7,Children & Family Movies
s7235,Movie,Krisha,United States,2015,R,"Dramas, Independent Movies"
s7237,Movie,Kristy,United States,2013,NR,Horror Movies
s7238,Movie,Krystal,United States,2017,R,"Comedies, Dramas"
s7239,Movie,Kuldip Patwal: I Didn't Do It!,India,2017,TV-MA,"Dramas, Independent Movies, International Movies"
s7240,Movie,Kung Fu Hustle,"Hong Kong, China, United States",2004,R,"Action & Adventure, Comedies, Cult Movies"
s7241,Movie,Kung Fu Magoo,"Mexico, United States",2010,TV-Y7,"Children & Family Movies, Comedies"
s7242,Movie,Kung Fu Panda: Holiday,United States,2010,TV-PG,"Children & Family Movies, Comedies"
s7243,Movie,Kung Fu Yoga,"China, India, Nepal",2017,TV-PG,"Action & Adventure, Comedies, International Movies"
s7245,Movie,Kurt & Courtney,United Kingdom,1998,R,"Documentaries, Music & Musicals"
s7247,Movie,Kurtulus Son Durak,Turkey,2012,TV-MA,"Comedies, Dramas, International Movies"
s7248,Movie,Kya Kehna,India,2000,TV-PG,"Dramas, International Movies, Romantic Movies"
s7249,Movie,Kygo: Live at the Hollywood Bowl,United States,2017,TV-MA,Music & Musicals
s7250,Movie,Kyun! Ho Gaya Na,India,2004,TV-PG,"International Movies, Romantic Movies"
s7251,Movie,La Última Fiesta,Argentina,2016,TV-MA,"Comedies, International Movies"
s7253,Movie,La Bamba,United States,1987,PG-13,"Classic Movies, Dramas, Music & Musicals"
s7254,Movie,La Coppia dei Campioni,Italy,2016,TV-MA,"Comedies, International Movies"
s7259,TV Show,La Viuda Negra,"Colombia, Mexico, United States",2016,TV-14,"Crime TV Shows, International TV Shows, Spanish-Language TV Shows"
s7260,Movie,Laal Rang,India,2016,TV-14,"Dramas, International Movies, Thrillers"
s7261,Movie,Laddaland,Thailand,2011,TV-MA,"Horror Movies, International Movies"
s7262,Movie,Lady Bloodfight,Hong Kong,2016,R,Action & Adventure
s7263,Movie,Lady in the Water,United States,2006,PG-13,"Sci-Fi & Fantasy, Thrillers"
s7266,Movie,Lalbaug Parel: Zali Mumbai Sonyachi,India,2010,TV-MA,"Dramas, International Movies"
s7268,Movie,Larceny,"United States, Mexico",2017,TV-14,Action & Adventure
s7270,Movie,Last Ferry,United States,2019,TV-MA,"Dramas, Independent Movies, LGBTQ Movies"
s7271,Movie,Last Knights,"United Kingdom, South Korea",2015,R,Action & Adventure
s7272,Movie,Last Night,"United States, France",2010,R,"Dramas, Independent Movies, Romantic Movies"
s7273,Movie,Le K Benzema,France,2017,TV-14,"Documentaries, International Movies, Sports Movies"
s7275,Movie,Leap Year,"United States, Ireland",2010,PG,"Comedies, Romantic Movies"
s7276,Movie,LeapFrog: Letter Factory,United States,2003,TV-Y,Children & Family Movies
s7277,Movie,LeapFrog: Numberland,United States,2011,TV-Y,Movies
s7278,Movie,LeapFrog: Phonics Farm,United States,2011,TV-Y,Movies
s7281,Movie,Lechmi,India,2017,TV-MA,"Comedies, Horror Movies, International Movies"
s7282,Movie,Left Behind,"United States, Canada",2014,PG-13,"Action & Adventure, Faith & Spirituality, Sci-Fi & Fantasy"
s7283,Movie,Legend of the Guardians: The Owls of Ga'Hoole,"United States, Australia",2010,PG,Children & Family Movies
s7284,Movie,Legend of the Naga Pearls,China,2017,TV-MA,"Action & Adventure, International Movies, Sci-Fi & Fantasy"
s7285,Movie,Legendary Weapons of China,Hong Kong,1982,TV-14,"Action & Adventure, Cult Movies, International Movies"
s7287,Movie,Legion,United States,2010,R,"Action & Adventure, Horror Movies, Sci-Fi & Fantasy"
s7289,TV Show,Lego Friends: Girls on a Mission,Denmark,2018,TV-Y,Kids' TV
s7293,Movie,Leo the Lion,"United States, Italy",2013,TV-Y7-FV,"Children & Family Movies, Comedies"
s7295,Movie,Let There Be Light,United States,1946,TV-PG,"Classic Movies, Documentaries"
s7296,TV Show,Leyla and Mecnun,Turkey,2014,TV-MA,"International TV Shows, Romantic TV Shows, TV Comedies"
s7297,Movie,Lez Bomb,United States,2018,TV-14,"Comedies, LGBTQ Movies"
s7299,Movie,Life After Beth,United States,2014,R,"Comedies, Horror Movies, Independent Movies"
s7303,Movie,Lifechanger,Canada,2018,TV-MA,"Horror Movies, Independent Movies, Thrillers"
s7304,Movie,Lifeline,Hong Kong,1997,TV-14,"Action & Adventure, International Movies"
s7305,Movie,Like Arrows,United States,2018,TV-PG,"Dramas, Faith & Spirituality"
s7306,Movie,Like Water for Chocolate,Mexico,1992,R,"Classic Movies, Dramas, International Movies"
s7307,Movie,Lila & Eve,United States,2015,R,"Dramas, Thrillers"
s7309,Movie,Lincoln,"United States, India",2012,PG-13,Dramas
s7310,Movie,Lion's Heart,Egypt,2013,TV-14,"Action & Adventure, International Movies"
s7312,Movie,Little Dragon Maiden,Hong Kong,1983,TV-14,"Action & Adventure, International Movies, Romantic Movies"
s7314,Movie,Little Lunch: The Halloween Horror Story,Australia,2016,TV-Y7,"Children & Family Movies, Comedies"
s7315,Movie,Little Lunch: The Nightmare Before Graduation,Australia,2016,TV-Y7,"Children & Family Movies, Comedies"
s7316,Movie,Little Men,"United States, Greece, Brazil",2016,PG,"Dramas, Independent Movies"
s7317,Movie,Little Nicky,United States,2000,PG-13,Comedies
s7321,Movie,Little Sister,United States,2016,NR,"Comedies, Dramas, Independent Movies"
s7323,Movie,Lizzie Borden Took an Ax,United States,2014,TV-14,Thrillers
s7324,Movie,Lo and Behold: Reveries of the Connected World,United States,2016,PG-13,Documentaries
s7327,Movie,"Lock, Stock and Two Smoking Barrels",United Kingdom,1998,R,"Action & Adventure, Comedies, Independent Movies"
s7328,Movie,Locke,"United Kingdom, United States",2013,R,"Dramas, Independent Movies"
s7329,Movie,Lockout,"France, United States",2012,PG-13,"Action & Adventure, International Movies, Sci-Fi & Fantasy"
s7330,Movie,Loco Love,Mexico,2017,TV-MA,"Dramas, Independent Movies, International Movies"
s7331,Movie,Logan's Run,United States,1976,PG,"Action & Adventure, Classic Movies, Cult Movies"
s7333,Movie,Lolita,"United Kingdom, United States",1962,R,"Classic Movies, Dramas, Romantic Movies"
s7334,TV Show,London Spy,United Kingdom,2015,TV-MA,"British TV Shows, Crime TV Shows, International TV Shows"
s7335,Movie,Long Time Running,Canada,2017,TV-14,"Documentaries, International Movies, Music & Musicals"
s7336,Movie,"Look Out, Officer",Hong Kong,1990,TV-14,"Action & Adventure, Comedies, International Movies"
s7337,Movie,Look Who's Back,Germany,2015,NR,"Comedies, International Movies"
s7338,Movie,Lorai: Play to Live,India,2015,TV-14,"Dramas, International Movies, Sports Movies"
s7345,Movie,Love Dot Com: The Social Experiment,United States,2019,TV-MA,"Comedies, Romantic Movies"
s7346,Movie,Love In A Puff,Hong Kong,2010,TV-MA,"Comedies, Dramas, International Movies"
s7347,Movie,Love Ni Bhavai,India,2017,TV-14,"Comedies, International Movies, Romantic Movies"
s7348,Movie,Love on Delivery,Hong Kong,1994,TV-14,"Action & Adventure, Comedies, International Movies"
s7351,Movie,Love Shot,United States,2018,TV-MA,"Dramas, Thrillers"
s7352,Movie,Love Station,Egypt,2011,TV-14,"Comedies, International Movies, Romantic Movies"
s7353,Movie,Love You... Love You Not,Indonesia,2015,TV-14,"Comedies, International Movies, Romantic Movies"
s7355,Movie,"Love, Rosie","Germany, United Kingdom",2014,R,"Comedies, International Movies, Romantic Movies"
s7357,Movie,Loving Annabelle,United States,2006,TV-MA,"Dramas, Independent Movies, LGBTQ Movies"
s7358,Movie,Loving You,Hong Kong,1995,TV-14,"Dramas, International Movies"
s7359,Movie,Lucha: Playing the Impossible,Argentina,2016,TV-PG,"Documentaries, International Movies, Sports Movies"
s7361,Movie,Lucky: No Time for Love,India,2005,TV-14,"Dramas, International Movies, Romantic Movies"
s7362,Movie,Lupt,India,2018,TV-14,"Horror Movies, International Movies, Thrillers"
s7363,Movie,Lusers,"Argentina, Chile, Peru",2015,TV-MA,"Comedies, International Movies, Sports Movies"
s7364,Movie,Ma Chu Ka,India,2017,TV-14,"International Movies, Thrillers"
s7365,Movie,Maacher Jhol,"India, France",2017,TV-PG,"Dramas, International Movies"
s7366,Movie,Mac & Devin Go to High School,United States,2012,R,Comedies
s7367,Movie,Macchli Jal Ki Rani Hai,India,2014,TV-MA,"Horror Movies, International Movies"
s7368,Movie,Mad Max,"Australia, United States",1979,R,"Action & Adventure, Classic Movies, Cult Movies"
s7370,Movie,Mad Money,United States,2008,PG-13,Comedies
s7371,Movie,Mad Ron's Prevues from Hell,United States,1987,NR,"Cult Movies, Horror Movies"
s7372,Movie,Mad World,Hong Kong,2016,TV-MA,"Dramas, International Movies"
s7373,Movie,Madaari,India,2016,TV-14,"Dramas, Independent Movies, International Movies"
s7374,Movie,Maddman: The Steve Madden Story,United States,2017,TV-MA,Documentaries
s7375,Movie,Madre,Chile,2016,TV-MA,"International Movies, Thrillers"
s7376,TV Show,Maggie & Bianca: Fashion Friends,Italy,2017,TV-Y7,"Kids' TV, TV Comedies"
s7378,Movie,Magic Snowflake,"France, Belgium",2013,TV-Y,Children & Family Movies
s7379,Movie,Magnetic,France,2018,TV-14,"Action & Adventure, Documentaries, International Movies"
