id,type,title,country,year,rating,genre
s8,Movie,Sankofa,"United States, Ghana, Burkina Faso, United Kingdom, Germany, Ethiopia",1993,TV-MA,"Dramas, Independent Movies, International Movies"
s9,TV Show,The Great British Baking Show,United Kingdom,2021,TV-14,"British TV Shows, Reality TV"
s10,Movie,The Starling,United States,2021,PG-13,"Comedies, Dramas"
s13,Movie,Je Suis Karl,"Germany, Czech Republic",2021,TV-MA,"Dramas, International Movies"
s25,Movie,Jeans,India,1998,TV-14,"Comedies, International Movies, Romantic Movies"
s28,Movie,Grown Ups,United States,2010,PG-13,Comedies
s29,Movie,Dark Skies,United States,2013,PG-13,"Horror Movies, Sci-Fi & Fantasy"
s30,Movie,Paranoia,"United States, India, France",2013,PG-13,Thrillers
s39,Movie,Birth of the Dragon,"China, Canada, United States",2017,PG-13,"Action & Adventure, Dramas"
s42,Movie,Jaws,United States,1975,PG,"Action & Adventure, Classic Movies, Dramas"
s43,Movie,Jaws 2,United States,1978,PG,"Dramas, Horror Movies, Thrillers"
s44,Movie,Jaws 3,United States,1983,PG,"Action & Adventure, Horror Movies, Thrillers"
s45,Movie,Jaws: The Revenge,United States,1987,PG-13,"Action & Adventure, Horror Movies, Thrillers"
s47,Movie,Safe House,"South Africa, United States, Japan",2012,R,Action & Adventure
s49,Movie,Training Day,United States,2001,R,"Dramas, Thrillers"
s52,Movie,InuYasha the Movie 2: The Castle Beyond the Looking Glass,Japan,2002,TV-14,"Action & Adventure, Anime Features, International Movies"
s53,Movie,InuYasha the Movie 3: Swords of an Honorable Ruler,Japan,2003,TV-14,"Action & Adventure, Anime Features, International Movies"
s54,Movie,InuYasha the Movie 4: Fire on the Mystic Island,Japan,2004,TV-PG,"Action & Adventure, Anime Features, International Movies"
s55,Movie,InuYasha the Movie: Affections Touching Across Time,Japan,2001,TV-PG,"Action & Adventure, Anime Features, International Movies"
s57,Movie,Naruto Shippuden the Movie: Blood Prison,Japan,2011,TV-14,"Action & Adventure, Anime Features, International Movies"
s58,Movie,Naruto Shippûden the Movie: Bonds,Japan,2008,TV-PG,"Action & Adventure, Anime Features, International Movies"
s59,Movie,Naruto Shippûden the Movie: The Will of Fire,Japan,2009,TV-PG,"Action & Adventure, Anime Features, International Movies"
s60,Movie,Naruto Shippuden: The Movie,Japan,2007,TV-PG,"Action & Adventure, Anime Features, International Movies"
s61,Movie,Naruto Shippuden: The Movie: The Lost Tower,Japan,2010,TV-14,"Action & Adventure, Anime Features, International Movies"
s62,Movie,Naruto the Movie 2: Legend of the Stone of Gelel,Japan,2005,TV-PG,"Action & Adventure, Anime Features, International Movies"
s63,Movie,Naruto the Movie 3: Guardians of the Crescent Moon Kingdom,Japan,2006,TV-PG,"Action & Adventure, Anime Features, International Movies"
s64,Movie,Naruto the Movie: Ninja Clash in the Land of Snow,Japan,2004,TV-PG,"Action & Adventure, Anime Features, International Movies"
s74,Movie,King of Boys,Nigeria,2018,TV-MA,"Dramas, International Movies"
s82,Movie,Kate,United States,2021,R,Action & Adventure
s85,Movie,Omo Ghetto: the Saga,Nigeria,2020,TV-MA,"Action & Adventure, Comedies, Dramas"
s91,Movie,Paradise Hills,"Spain, United States",2019,TV-MA,"Sci-Fi & Fantasy, Thrillers"
s95,Movie,Show Dogs,"United Kingdom, United States",2018,PG,"Children & Family Movies, Comedies"
s97,Movie,If I Leave Here Tomorrow: A Film About Lynyrd Skynyrd,United States,2018,TV-MA,"Documentaries, Music & Musicals"
s106,Movie,Angamaly Diaries,India,2017,TV-14,"Action & Adventure, Comedies, Dramas"
s108,Movie,A Champion Heart,United States,2018,G,"Children & Family Movies, Dramas"
s115,Movie,Anjaam,India,1994,TV-14,"Dramas, International Movies, Thrillers"
s116,Movie,Bright Star,"United Kingdom, Australia, France",2009,PG,"Dramas, Romantic Movies"
s117,Movie,Dhanak,India,2015,TV-PG,"Comedies, Dramas, Independent Movies"
s119,Movie,Gurgaon,India,2017,TV-14,"Dramas, International Movies, Thrillers"
s123,Movie,In the Cut,"United Kingdom, Australia, France, United States",2003,R,Thrillers
s127,Movie,Shikara,India,2020,TV-14,"Dramas, International Movies, Romantic Movies"
s128,Movie,A Cinderella Story,"United States, Canada",2004,PG,"Children & Family Movies, Comedies"
s130,Movie,An Unfinished Life,"Germany, United States",2005,PG-13,Dramas
s132,Movie,Blade Runner: The Final Cut,United States,1982,R,"Action & Adventure, Classic Movies, Cult Movies"
s134,Movie,Chappie,"South Africa, United States",2015,R,"Action & Adventure, Sci-Fi & Fantasy"
s135,Movie,Clear and Present Danger,"United States, Mexico",1994,PG-13,"Action & Adventure, Dramas"
s136,Movie,Cliffhanger,"United States, Italy, France, Japan",1993,R,Action & Adventure
s137,Movie,Cold Mountain,"United States, Italy, Romania, United Kingdom",2003,R,"Dramas, Romantic Movies"
s138,Movie,Crocodile Dundee in Los Angeles,"Australia, United States",2001,PG,"Action & Adventure, Comedies"
s139,Movie,Dear John,United States,2010,PG-13,"Dramas, Romantic Movies"
s140,Movie,Do the Right Thing,United States,1989,R,"Classic Movies, Comedies, Dramas"
s141,Movie,"El patrón, radiografía de un crimen","Argentina, Venezuela",2014,TV-MA,"Dramas, International Movies, Thrillers"
s142,Movie,Extraction,"United States, United Kingdom, Canada",2015,R,Action & Adventure
s143,Movie,Freedom Writers,"Germany, United States",2007,PG-13,Dramas
s144,Movie,Green Lantern,United States,2011,PG-13,"Action & Adventure, Sci-Fi & Fantasy"
s145,Movie,House Party,United States,1990,R,"Comedies, Cult Movies"
s146,Movie,House Party 2,United States,1991,R,"Comedies, Cult Movies, Music & Musicals"
s147,Movie,House Party 3,United States,1994,R,"Comedies, Music & Musicals"
s150,Movie,I Got the Hook Up,United States,1998,R,"Action & Adventure, Comedies"
s151,Movie,In Too Deep,United States,1999,R,Thrillers
s152,Movie,Initial D,"China, Hong Kong",2005,TV-14,"Action & Adventure, International Movies"
s153,Movie,Janoskians: Untold and Untrue,United States,2016,TV-MA,Comedies
s156,Movie,Labyrinth,"United Kingdom, United States",1986,PG,"Action & Adventure, Children & Family Movies, Cult Movies"
s157,Movie,Letters to Juliet,United States,2010,PG,"Comedies, Dramas, Romantic Movies"
s158,Movie,Level 16,Canada,2018,TV-14,"Sci-Fi & Fantasy, Thrillers"
s159,Movie,Love Don't Cost a Thing,United States,2003,PG-13,"Comedies, Romantic Movies"
s160,Movie,Love in a Puff,Hong Kong,2010,TV-MA,"Comedies, Dramas, International Movies"
s162,Movie,Mars Attacks!,United States,1996,PG-13,"Comedies, Cult Movies, Sci-Fi & Fantasy"
s163,Movie,Marshall,"United States, China, Hong Kong",2017,PG-13,Dramas
s164,Movie,My Boss's Daughter,United States,2003,R,"Comedies, Romantic Movies"
s165,Movie,Mystery Men,United States,1999,PG-13,"Action & Adventure, Comedies"
s167,Movie,Once Upon a Time in America,"Italy, United States",1984,R,"Classic Movies, Dramas"
s168,Movie,Open Season 2,"United States, Canada",2008,PG,"Children & Family Movies, Comedies"
s169,Movie,Osmosis Jones,United States,2001,PG,"Action & Adventure, Children & Family Movies, Comedies"
s170,Movie,Poseidon,United States,2006,PG-13,"Action & Adventure, Dramas"
s171,Movie,Rhyme & Reason,United States,1997,R,"Documentaries, Music & Musicals"
s172,Movie,Same Kind of Different as Me,United States,2017,PG-13,"Dramas, Faith & Spirituality"
s173,Movie,School of Rock,"United States, Germany",2003,PG-13,"Comedies, Music & Musicals"
s174,Movie,Snervous Tyler Oakley,United States,2015,PG-13,"Documentaries, LGBTQ Movies"
s175,Movie,Tears of the Sun,United States,2003,R,"Action & Adventure, Dramas"
s176,Movie,The Blue Lagoon,United States,1980,R,"Dramas, Romantic Movies"
s177,Movie,The Golden Child,United States,1986,PG-13,"Action & Adventure, Comedies"
s178,Movie,The Guns of Navarone,"United Kingdom, United States",1961,TV-14,"Action & Adventure, Classic Movies"
s179,Movie,The Interview,United States,2014,R,"Action & Adventure, Comedies"
s180,Movie,The Nutty Professor,United States,1996,PG-13,"Comedies, Romantic Movies"
s183,Movie,Welcome Home Roscoe Jenkins,United States,2008,PG-13,Comedies
s184,Movie,In the Line of Fire,United States,1993,R,"Action & Adventure, Classic Movies"
s189,Movie,2 Alone in Paris,France,2008,TV-MA,"Comedies, International Movies"
s191,Movie,Thimmarusu,India,2021,TV-14,"Dramas, International Movies"
s192,Movie,Wind River,"United Kingdom, Canada, United States",2017,R,"Dramas, Independent Movies"
s193,Movie,C Kkompany,India,2008,TV-14,"Action & Adventure, Comedies, International Movies"
s196,Movie,EMI: Liya Hai To Chukana Padega,India,2008,TV-14,"Comedies, Dramas, International Movies"
s199,TV Show,King of Boys: The Return of the King,Nigeria,2021,TV-MA,"Crime TV Shows, International TV Shows, TV Dramas"
s200,Movie,Koi Aap Sa,India,2006,TV-14,"Comedies, Dramas, International Movies"
s201,Movie,Krishna Cottage,India,2004,TV-14,"Action & Adventure, Horror Movies, International Movies"
s202,Movie,Kucch To Hai,India,2003,TV-14,"Dramas, International Movies, Thrillers"
s203,Movie,Kyaa Kool Hai Hum,India,2005,TV-MA,"Comedies, International Movies, Music & Musicals"
s204,Movie,Kyaa Kool Hain Hum 3,India,2016,TV-MA,"Comedies, International Movies"
s205,Movie,Kyaa Super Kool Hain Hum,India,2012,TV-MA,"Comedies, International Movies"
s206,Movie,Kyo Kii... Main Jhuth Nahin Bolta,India,2001,TV-14,"Comedies, International Movies, Sci-Fi & Fantasy"
s207,Movie,"LSD: Love, Sex Aur Dhokha",India,2010,TV-MA,"Dramas, Independent Movies, International Movies"
s208,Movie,Mission Istaanbul: Darr Ke Aagey Jeet Hai,India,2008,TV-14,"Action & Adventure, International Movies, Music & Musicals"
s209,Movie,Once Upon a Time in Mumbaai,India,2010,TV-14,"Dramas, International Movies, Music & Musicals"
s210,Movie,Once Upon a Time in Mumbai Dobaara!,India,2013,TV-14,"Dramas, International Movies, Music & Musicals"
s211,Movie,Ragini MMS,India,2011,TV-MA,"Horror Movies, International Movies"
s212,Movie,Ragini MMS 2,India,2014,TV-MA,"Horror Movies, International Movies"
s216,Movie,Shootout at Lokhandwala,India,2007,TV-MA,"Action & Adventure, Dramas, International Movies"
s217,Movie,Shor In the City,India,2011,TV-14,"Comedies, Dramas, Independent Movies"
s218,Movie,The Dirty Picture,India,2011,TV-14,"Comedies, Dramas, International Movies"
s228,Movie,Really Love,United States,2020,TV-MA,"Dramas, Independent Movies, Romantic Movies"
s229,Movie,The November Man,"United States, United Kingdom",2014,R,Action & Adventure
s230,Movie,The Old Ways,United States,2020,TV-MA,Horror Movies
s232,Movie,The Water Man,United States,2021,PG,"Children & Family Movies, Dramas"
s248,Movie,Sweet Girl,United States,2021,R,"Action & Adventure, Dramas"
s252,Movie,Like Crazy,United States,2011,PG-13,"Dramas, Independent Movies, Romantic Movies"
s254,Movie,Bombay,India,1995,TV-14,"Dramas, International Movies, Romantic Movies"
s260,Movie,Pahuna,"India, Nepal",2018,TV-PG,"Comedies, Dramas, International Movies"
s265,Movie,Walk of Shame,United States,2014,R,"Comedies, Independent Movies"
s268,Movie,The Piano,"New Zealand, Australia, France, United States",1993,R,"Classic Movies, Dramas, Independent Movies"
s271,Movie,Beckett,"Italy, Brazil, Greece",2021,TV-MA,Action & Adventure
s274,TV Show,Gone for Good,France,2021,TV-MA,"Crime TV Shows, International TV Shows, TV Dramas"
s277,TV Show,Valeria,Spain,2021,TV-MA,"International TV Shows, Romantic TV Shows, Spanish-Language TV Shows"
s279,Movie,Lokillo: Nothing's the Same,Colombia,2021,TV-MA,Stand-Up Comedy
s280,Movie,Monster Hunter: Legends of the Guild,"United States, Japan",2021,TV-PG,"Action & Adventure, Anime Features, Children & Family Movies"
s282,Movie,Brother Jekwu,Nigeria,2016,TV-14,"Comedies, International Movies"
s283,Movie,La diosa del asfalto,Mexico,2020,TV-MA,"Dramas, Independent Movies, International Movies"
s285,Movie,The Kissing Booth 3,"United Kingdom, United States",2021,TV-14,"Comedies, Romantic Movies"
s286,Movie,The Railway Man,"Switzerland, United Kingdom, Australia",2013,R,"Dramas, International Movies"
s293,Movie,Quartet,United Kingdom,2012,PG-13,"Comedies, Dramas, Independent Movies"
s294,Movie,Slay,South Africa,2021,TV-MA,"Comedies, International Movies, Romantic Movies"
s296,Movie,The Paper Tigers,United States,2021,PG-13,"Action & Adventure, Comedies"
s298,TV Show,Navarasa,India,2021,TV-MA,TV Shows
s299,Movie,Quam's Money,Nigeria,2020,TV-MA,"Comedies, Dramas, International Movies"
s300,Movie,The Swarm,France,2021,TV-14,"Horror Movies, Independent Movies, International Movies"
s301,Movie,Vivo,"Canada, United States",2021,PG,"Children & Family Movies, Music & Musicals"
s302,Movie,Chennai Express,India,2013,TV-14,"Action & Adventure, Comedies, International Movies"
s304,Movie,Esperando la carroza,Argentina,1985,TV-MA,"Comedies, Cult Movies, International Movies"
s305,Movie,Lady Boss: The Jackie Collins Story,United Kingdom,2021,TV-14,Documentaries
s306,Movie,Tango Feroz,"Argentina, Spain",1993,TV-MA,"Classic Movies, Dramas, International Movies"
s307,Movie,'76,Nigeria,2016,TV-PG,"Dramas, International Movies"
s308,Movie,Aftermath,United States,2021,TV-MA,Horror Movies
s309,Movie,American Masters: Inventing David Geffen,United States,2012,TV-MA,Movies
s315,Movie,Heavy,United States,1995,R,"Dramas, Independent Movies, Romantic Movies"
s316,Movie,Ije: The Journey,"United States, Nigeria",2010,TV-MA,"Dramas, International Movies"
s317,TV Show,Office Girls,Taiwan,2011,TV-14,"International TV Shows, Romantic TV Shows, TV Comedies"
s326,Movie,Beethoven,United States,1992,PG,"Children & Family Movies, Comedies"
s327,Movie,Beethoven's 2nd,United States,1993,PG,"Children & Family Movies, Comedies"
s328,Movie,Beowulf,"United States, United Kingdom",2007,PG-13,"Action & Adventure, Sci-Fi & Fantasy"
s329,Movie,Boyka: Undisputed,"Bulgaria, United States",2016,R,Action & Adventure
s330,Movie,Catch Me If You Can,"United States, Canada",2002,PG-13,Dramas
s331,Movie,Cloudy with a Chance of Meatballs,"United States, Canada",2009,PG,"Children & Family Movies, Comedies, Sci-Fi & Fantasy"
s333,Movie,Deep Blue Sea,"United States, Mexico",1999,R,"Action & Adventure, Horror Movies, Sci-Fi & Fantasy"
s334,Movie,Ferris Bueller's Day Off,United States,1986,PG-13,"Classic Movies, Comedies, Cult Movies"
s335,Movie,Five Feet Apart,United States,2019,PG-13,"Dramas, Romantic Movies"
s336,Movie,Freedomland,United States,2006,R,"Dramas, Thrillers"
s338,Movie,Good Luck Chuck,"United States, Canada",2007,R,"Comedies, Romantic Movies"
s341,Movie,Inception,"United States, United Kingdom",2010,PG-13,"Action & Adventure, Sci-Fi & Fantasy, Thrillers"
s342,Movie,Magnolia,United States,1999,R,"Dramas, Independent Movies"
s343,Movie,Major Payne,United States,1995,PG-13,Comedies
s344,Movie,My Girl,United States,1991,PG-13,Dramas
s345,Movie,My Girl 2,United States,1994,PG,"Children & Family Movies, Comedies, Dramas"
s346,Movie,Open Season: Scared Silly,"United States, Canada",2015,PG,"Children & Family Movies, Comedies"
s347,Movie,Pineapple Express,United States,2008,R,"Action & Adventure, Comedies"
s348,Movie,Planet 51,"Spain, United Kingdom, United States",2009,PG,"Children & Family Movies, Comedies, Sci-Fi & Fantasy"
s349,Movie,Poms,"United Kingdom, United States",2019,PG-13,Comedies
s350,Movie,Seabiscuit,United States,2003,PG-13,"Dramas, Sports Movies"
s351,Movie,Space Cowboys,United States,2000,PG-13,"Action & Adventure, Dramas, Sci-Fi & Fantasy"
s352,Movie,Team America: World Police,"United States, Germany",2004,R,"Action & Adventure, Comedies, Cult Movies"
s353,Movie,The Edge of Seventeen,"United States, China",2016,R,"Comedies, Dramas"
s354,Movie,The Haunting in Connecticut 2: Ghosts of Georgia,United States,2013,R,Horror Movies
s355,Movie,The Last Boy Scout,United States,1991,R,"Action & Adventure, Comedies"
s356,Movie,The Lincoln Lawyer,United States,2011,R,"Dramas, Thrillers"
s357,Movie,The Losers,"United States, France",2010,PG-13,Action & Adventure
s358,Movie,The Machinist,"Spain, France, United Kingdom, United States",2004,R,"Dramas, Independent Movies, Thrillers"
s359,Movie,The Net,United States,1995,PG-13,Thrillers
s360,Movie,The Original Kings of Comedy,United States,2000,R,Stand-Up Comedy
s361,Movie,Valentine's Day,United States,2010,PG-13,"Comedies, Romantic Movies"
s366,Movie,Eyes of a Thief,", France, Algeria",2014,TV-14,"Dramas, Independent Movies, International Movies"
s375,Movie,Flower Girl,Nigeria,2013,TV-PG,"Comedies, International Movies, Romantic Movies"
s378,Movie,Bartkowiak,Poland,2021,TV-MA,"Action & Adventure, International Movies"
s381,TV Show,The Flash,United States,2021,TV-14,"Crime TV Shows, TV Action & Adventure, TV Sci-Fi & Fantasy"
s384,Movie,Department,India,2012,TV-MA,"Action & Adventure, International Movies"
s390,Movie,The Operative,"France, Israel, Germany, United States, United Kingdom",2019,TV-MA,"Dramas, International Movies, Thrillers"
s393,Movie,Django Unchained,United States,2012,R,"Action & Adventure, Dramas"
s394,Movie,A Second Chance:  Rivals!,Australia,2021,PG,"Children & Family Movies, Sports Movies"
s403,Movie,The Last Letter From Your Lover,United Kingdom,2021,TV-MA,"Dramas, Romantic Movies"
s411,Movie,Chhota Bheem And The Broken Amulet,India,2013,TV-Y7,Children & Family Movies
s416,Movie,Chhota Bheem aur Krishna,India,2009,TV-Y7,Children & Family Movies
s427,Movie,Cousins,New Zealand,2021,TV-MA,Dramas
s430,Movie,Sanitation Day,Nigeria,2020,TV-14,"Dramas, International Movies, Thrillers"
s434,Movie,Milkwater,United States,2020,TV-MA,"Comedies, Dramas, Independent Movies"
s437,Movie,The Tambour of Retribution,Saudi Arabia,2021,TV-14,"Dramas, International Movies, Romantic Movies"
s438,Movie,Cosmic Sin,United States,2021,R,Action & Adventure
s440,Movie,Deep,Thailand,2021,TV-MA,"Dramas, International Movies, Thrillers"
s446,Movie,The Beguiled,United States,2017,R,"Dramas, Independent Movies, Thrillers"
s447,Movie,The Book of Henry,United States,2017,PG-13,Dramas
s448,Movie,The Twilight Saga: Breaking Dawn: Part 1,United States,2011,PG-13,"Dramas, Romantic Movies"
s449,Movie,The Twilight Saga: Breaking Dawn: Part 2,United States,2012,PG-13,"Dramas, Romantic Movies"
s450,Movie,The Twilight Saga: Eclipse,United States,2010,PG-13,"Dramas, Romantic Movies"
s451,Movie,The Twilight Saga: New Moon,United States,2009,PG-13,"Dramas, Romantic Movies"
s452,Movie,Twilight,United States,2008,PG-13,"Action & Adventure, Dramas, Romantic Movies"
s453,Movie,A Perfect Fit,Indonesia,2021,TV-PG,"Comedies, Dramas, International Movies"
s461,Movie,Surf's Up,"United States, Canada",2007,PG,"Children & Family Movies, Comedies, Sports Movies"
s464,Movie,A Classic Horror Story,Italy,2021,TV-MA,"Horror Movies, International Movies"
s470,Movie,American Woman,"United States, Canada",2019,TV-MA,"Dramas, Independent Movies"
s475,Movie,American Ultra,"United States, Switzerland",2015,R,"Action & Adventure, Comedies"
s487,Movie,Ratchet and Clank,"Hong Kong, Canada, United States",2016,PG,"Children & Family Movies, Comedies, Sci-Fi & Fantasy"
s490,Movie,Back to Q82,"Kuwait, United States",2017,TV-14,"Comedies, International Movies"
s492,Movie,Home Again,United States,2017,PG-13,"Comedies, Dramas, Romantic Movies"
s493,Movie,Midnight Sun,United States,2018,PG-13,"Dramas, Romantic Movies"
s495,Movie,Rock the Kasbah,United States,2015,R,"Comedies, Music & Musicals"
s497,Movie,Brick Mansions,"France, Canada, United States, Spain",2014,PG-13,"Action & Adventure, International Movies"
s503,Movie,Tango With Me,Nigeria,2010,TV-14,"Dramas, International Movies, Romantic Movies"
s504,TV Show,The Mire,Poland,2021,TV-MA,"Crime TV Shows, International TV Shows, TV Dramas"
s507,Movie,This Little Love Of Mine,Australia,2021,TV-G,"International Movies, Romantic Movies"
s509,Movie,A Land Imagined,"France, Netherlands, Singapore",2019,TV-MA,"Dramas, International Movies"
s519,Movie,Har Kisse Ke Hisse: Kaamyaab,India,2020,TV-14,"Dramas, International Movies"
s529,Movie,Rehmataan,India,2012,TV-14,"Dramas, International Movies, Romantic Movies"
s530,Movie,Return of the Prodigal Son,Egypt,1976,TV-MA,"Dramas, International Movies"
s532,Movie,Rise: Ini Kalilah,Malaysia,2018,TV-PG,"Dramas, International Movies"
s535,Movie,Si Doel the Movie 2,Indonesia,2019,TV-G,"Dramas, International Movies"
s542,Movie,Truckbhar Swapna,India,2018,TV-14,"Comedies, Dramas, International Movies"
s543,Movie,Ujala,India,1959,TV-14,"Dramas, International Movies"
s552,Movie,Haseen Dillruba,India,2021,TV-MA,"International Movies, Romantic Movies, Thrillers"
s555,Movie,RattleSnake - The Ahanna Story,Nigeria,2020,TV-MA,"Dramas, International Movies, Thrillers"
s556,Movie,Snowpiercer,"South Korea, Czech Republic",2013,R,"Action & Adventure, Cult Movies, International Movies"
s557,Movie,The 8th Night,South Korea,2021,TV-14,"Horror Movies, International Movies, Thrillers"
s558,Movie,Winchester,"Australia, United States",2018,PG-13,"Horror Movies, Sci-Fi & Fantasy"
s559,Movie,6 Bullets,United States,2012,R,Action & Adventure
s560,Movie,Air Force One,"United States, Germany",1997,R,Action & Adventure
s562,Movie,Austin Powers in Goldmember,United States,2002,PG-13,"Action & Adventure, Comedies"
s563,Movie,Austin Powers: International Man of Mystery,United States,1997,PG-13,Comedies
s564,Movie,Austin Powers: The Spy Who Shagged Me,United States,1999,PG-13,"Action & Adventure, Comedies, Sci-Fi & Fantasy"
s565,Movie,Boogie Nights,United States,1997,R,"Comedies, Dramas, Independent Movies"
s567,Movie,Charlie's Angels,"United States, Germany",2000,PG-13,"Action & Adventure, Comedies"
s568,Movie,Congo,United States,1995,PG-13,"Action & Adventure, Thrillers"
s569,Movie,Dennis the Menace,United States,1993,PG,"Children & Family Movies, Comedies"
s570,Movie,Dreamy Eyes,Vietnam,2019,TV-14,"Dramas, International Movies, Romantic Movies"
s573,Movie,Hampstead,"United Kingdom, Belgium",2019,PG-13,"Comedies, Dramas, International Movies"
s574,Movie,Kung Fu Panda,"United States, China",2008,PG,"Children & Family Movies, Comedies"
s575,Movie,Kung Fu Panda 2,"United States, China",2011,PG,"Children & Family Movies, Comedies"
s576,Movie,Life as We Know It,United States,2010,PG-13,"Comedies, Dramas, Romantic Movies"
s577,Movie,Mary Magdalene,"United Kingdom, Australia, United States",2019,R,"Dramas, Faith & Spirituality, International Movies"
s579,Movie,Memoirs of a Geisha,"France, Japan, United States",2005,PG-13,"Dramas, Romantic Movies"
s580,Movie,Midnight Run,United States,1988,R,"Action & Adventure, Classic Movies, Comedies"
s582,Movie,Mortal Kombat,United States,1995,PG-13,"Action & Adventure, Sci-Fi & Fantasy"
s583,Movie,Mother's Day,United States,2016,PG-13,"Comedies, Dramas"
s584,Movie,No Strings Attached,"United States, United Kingdom",2011,R,"Comedies, Romantic Movies"
s585,Movie,Not Another Teen Movie,United States,2001,R,Comedies
s586,Movie,Ophelia,"United Kingdom, United States",2018,PG-13,"Dramas, Romantic Movies"
s590,Movie,Red Joan,United Kingdom,2019,R,"Dramas, International Movies"
s592,Movie,Seven Pounds,United States,2008,PG-13,"Dramas, Romantic Movies"
s593,Movie,She's Out of My League,United States,2010,R,"Comedies, Romantic Movies"
s594,Movie,Snow Day,United States,2000,PG,"Children & Family Movies, Comedies"
s595,Movie,Star Trek,"United States, Germany",2009,PG-13,"Action & Adventure, Sci-Fi & Fantasy"
s596,Movie,Stuart Little,"Germany, United States",1999,PG,"Children & Family Movies, Comedies"
s597,Movie,Sword of Trust,United States,2019,R,"Comedies, Dramas, Independent Movies"
s598,Movie,Talladega Nights: The Ballad of Ricky Bobby,United States,2006,PG-13,"Action & Adventure, Comedies, Sports Movies"
s599,Movie,The American,"United States, United Kingdom",2010,R,"Dramas, Thrillers"
s600,Movie,The Best of Enemies,United States,2019,PG-13,Dramas
s601,Movie,The Game,United States,1997,R,Thrillers
s602,Movie,The Karate Kid,United States,1984,PG,"Action & Adventure, Children & Family Movies, Classic Movies"
s603,Movie,The Karate Kid Part II,United States,1986,PG,"Action & Adventure, Children & Family Movies, Dramas"
s604,Movie,The Karate Kid Part III,United States,1989,PG,"Children & Family Movies, Dramas"
s605,Movie,The Life of David Gale,"United Kingdom, Germany, Spain, United States",2003,R,Dramas
s606,Movie,The Long Riders,United States,1980,R,Action & Adventure
s607,Movie,The Queen,"United Kingdom, United States, France, Italy",2006,PG-13,"Dramas, International Movies"
s608,Movie,The Strangers,United States,2008,R,"Horror Movies, Thrillers"
s609,Movie,The Sum of All Fears,"United States, Germany, Canada",2002,PG-13,Action & Adventure
s610,Movie,The Tourist,"United States, France, Italy, United Kingdom",2010,PG-13,"Action & Adventure, Romantic Movies"
s611,Movie,Underworld,"United States, United Kingdom, Germany, Hungary",2003,R,"Action & Adventure, Horror Movies, Sci-Fi & Fantasy"
s612,Movie,Underworld: Awakening,"United States, Canada",2012,R,"Action & Adventure, Horror Movies, Sci-Fi & Fantasy"
s613,Movie,Underworld: Rise of the Lycans,"United States, New Zealand",2009,R,"Action & Adventure, Horror Movies, Sci-Fi & Fantasy"
s614,Movie,Voiceless,Nigeria,2020,TV-MA,"Dramas, International Movies, Thrillers"
s615,Movie,What Dreams May Come,"United States, New Zealand",1998,PG-13,"Dramas, Romantic Movies, Sci-Fi & Fantasy"
s616,Movie,Why Do Fools Fall in Love,United States,1998,R,"Dramas, Music & Musicals, Romantic Movies"
s619,Movie,America: The Motion Picture,United States,2021,TV-MA,"Action & Adventure, Comedies"
s623,Movie,Lying and Stealing,United States,2019,R,Thrillers
s631,Movie,Killing Them Softly,United States,2012,R,Dramas
s635,Movie,Wonder Boy,France,2019,TV-14,"Documentaries, International Movies"
s636,Movie,Here Comes the Rain,Lebanon,2010,TV-MA,"Dramas, International Movies"
s637,Movie,The Ice Road,"United States, Canada",2021,PG-13,Action & Adventure
s644,Movie,The Seventh Day,United States,2021,R,Horror Movies
s651,Movie,O Vendedor de Sonhos,Brazil,2016,TV-14,"Dramas, International Movies"
s652,Movie,Osuofia in London,Nigeria,2003,TV-MA,"Comedies, Dramas, International Movies"
